<?xml version="1.0" encoding="UTF-8"?>
<sponge xmlns="http://sponge.openksavi.org" xmlns:xsi="http://www.w3.org/2001/XMLSchema-instance"
    xsi:schemaLocation="http://sponge.openksavi.org http://sponge.openksavi.org/schema/config.xsd">

    <properties>
        <!-- News that have less words in the title than specified by this parameter will be rejected by filters. -->
        <property name="newsFilterWordThreshold" variable="true">3</property>
        <!-- Max size of a buffer that stores latest news. -->
        <property name="latestNewsMaxSize" variable="true">5</property>
        <!-- Knowledge base files directory. -->
        <property name="kbDir">examples/standalone/news/kb</property>
    </properties>

    <knowledgeBases>
        <!-- Main knowledge base (implemented in Python) that uses 3 files. These files will be loaded by the same interpreter. -->
        <knowledgeBase name="main">
            <!-- Plugin implemented in Python. -->
            <file>${kbDir}/main_plugins.py</file>
            <!-- Main event processors. For the sake of clarity registration of event processors is placed in the next file. -->
            <file>${kbDir}/main_event_processors.py</file>
            <!-- Knowledge base callback functions: onInit, onLoad, etc. -->
            <file>${kbDir}/main_functions.py</file>
        </knowledgeBase>
        <!-- Actions knowledge base (implemented in JavaScript). -->
        <knowledgeBase name="actions">
            <file>${kbDir}/actions.js</file>
        </knowledgeBase>
        <!-- News generator knowledge base. -->
        <knowledgeBase name="newsGenerator">
            <file>${kbDir}/news_generator.py</file>
        </knowledgeBase>
    </knowledgeBases>

    <plugins>
        <!-- Plugin defined in Python. Stores the last news entry". -->
        <plugin name="storagePlugin" class="StoragePlugin" knowledgeBaseName="main">
            <configuration>
                <storedValue>no news yet</storedValue>
            </configuration>
        </plugin>
    </plugins>
</sponge>

