<?xml version="1.0" encoding="UTF-8"?>
<sponge xmlns="https://sponge.openksavi.org" xmlns:xsi="http://www.w3.org/2001/XMLSchema-instance"
    xsi:schemaLocation="https://sponge.openksavi.org https://sponge.openksavi.org/schema/config.xsd">

    <properties>
        <property name="password.file">${sponge.configDir}/password.txt</property>
        <property name="camera.dir">${sponge.home}/data/camera</property>
        <property name="pictureFormat" variable="true">jpg</property>
    </properties>

    <knowledgeBases>
        <knowledgeBase name="grovepi" label="Grove Pi">
            <file>sponge_iot_grovepi_device.py</file>
            <file>sponge_iot_grovepi.py</file>
            <file>sponge_iot_grovepi_manage_lcd.py</file>
            <file>sponge_iot_grovepi_manage_sensors.py</file>
            <file>sponge_iot_grovepi_listeners.py</file>
            <file>sponge_iot_grovepi_light.py</file>
        </knowledgeBase>
        <knowledgeBase name="email" label="Email">
            <file>sponge_iot_email.py</file>
        </knowledgeBase>
        <knowledgeBase name="sms" label="SMS">
            <file>sponge_iot_sms.py</file>
            <file>sponge_iot_sms_notification.py</file>
        </knowledgeBase>
        <knowledgeBase name="camera" label="Camera">
            <file>sponge_iot_camera.py</file>
        </knowledgeBase>
        <knowledgeBase name="iot" label="IoT">
            <file>sponge_iot.py</file>
            <file>classpath*:org/openksavi/sponge/restapi/server/engine_public_library.py</file>
        </knowledgeBase>
        <knowledgeBase name="os" label="OS">
            <file>sponge_iot_os.py</file>
        </knowledgeBase>
        <knowledgeBase name="events" label="Events">
            <file>sponge_iot_grpc.py</file>
        </knowledgeBase>
        <knowledgeBase name="admin" label="Admin">
            <file>classpath*:org/openksavi/sponge/restapi/server/engine_admin_library.py</file>
        </knowledgeBase>
        <knowledgeBase name="security" label="Security">
            <file>rest_api_security.py</file>
        </knowledgeBase>
    </knowledgeBases>

    <plugins>
        <plugin name="standalone" class="org.openksavi.sponge.standalone.StandalonePlugin">
            <configuration>
                <spring camel="true" />
            </configuration>
        </plugin>

        <plugin name="grovepi" class="org.openksavi.sponge.rpi.grovepi.GrovePiPlugin" />

        <plugin name="gsm" class="org.openksavi.sponge.gsmmodem.GammuGsmModemPlugin" />

        <plugin name="restApiServer" class="org.openksavi.sponge.restapi.server.RestApiServerPlugin">
            <configuration>
                <autoStart>false</autoStart>
                <allowAnonymous>false</allowAnonymous>
                <securityServiceClass>org.openksavi.sponge.restapi.server.security.SimpleInMemorySecurityService</securityServiceClass>
            </configuration>
        </plugin>
        <plugin name="grpcApiServer" class="org.openksavi.sponge.grpcapi.server.GrpcApiServerPlugin">
            <configuration>
                <autoStart>false</autoStart>
            </configuration>
        </plugin>
    </plugins>
</sponge>

