<?xml version="1.0" encoding="UTF-8"?>
<sponge xmlns="https://sponge.openksavi.org" xmlns:xsi="http://www.w3.org/2001/XMLSchema-instance"
    xsi:schemaLocation="https://sponge.openksavi.org https://sponge.openksavi.org/schema/config.xsd">

    <properties>
        <!-- Base directory. -->
        <property name="baseDir" variable="true">examples/standalone/camel_template</property>
        <property name="templateUri" variable="true">file:${baseDir}/template.mustache</property>
    </properties>

    <knowledgeBases>
        <!-- Main knowledge base (implemented in Python). -->
        <knowledgeBase name="main">
            <file>${baseDir}/main.py</file>
        </knowledgeBase>
    </knowledgeBases>

    <plugins>
        <!-- Standalone plugin that configures Spring and Camel. -->
        <plugin name="standalonePlugin" class="org.openksavi.sponge.standalone.StandalonePlugin">
            <configuration>
                <spring camel="true">
                    <file>${baseDir}/CamelRoutes.groovy</file>
                </spring>
            </configuration>
        </plugin>
    </plugins>
</sponge>

