<?xml version="1.0" encoding="UTF-8"?>
<sponge xmlns="https://sponge.openksavi.org" xmlns:xsi="http://www.w3.org/2001/XMLSchema-instance" xsi:schemaLocation="https://sponge.openksavi.org https://sponge.openksavi.org/schema/config.xsd">
    <properties>
        <property name="password.file">${sponge.configDir}/password.txt</property>
    </properties>

    <engine name="mpd" label="MPD"/>

    <knowledgeBases>
        <knowledgeBase name="mpd" label="MPD">
            <file>classpath*:sponge/mpd-mpc/**/*.py</file>
        </knowledgeBase>
        <knowledgeBase name="administration" label="Administration">
            <file>classpath*:sponge/engine/*.py</file>
        </knowledgeBase>
        <knowledgeBase name="security" label="Security">
            <file>remote_api_security.py</file>
        </knowledgeBase>
    </knowledgeBases>

    <plugins>
        <plugin name="standalone" class="org.openksavi.sponge.standalone.StandalonePlugin">
            <configuration>
                <spring camel="true" />
            </configuration>
        </plugin>
        <plugin name="remoteApiServer" class="org.openksavi.sponge.remoteapi.server.RemoteApiServerPlugin">
            <configuration>
                <allowAnonymous>true</allowAnonymous>
                <securityProviderClass>org.openksavi.sponge.remoteapi.server.security.SimpleInMemorySecurityProvider</securityProviderClass>
                <registerServiceDiscovery>true</registerServiceDiscovery>
            </configuration>
        </plugin>
        <plugin name="grpcApiServer" class="org.openksavi.sponge.grpcapi.server.GrpcApiServerPlugin"/>
    </plugins>
</sponge>

